{
  "schemaVersion": 2,
  "catalogId": "workload-catalog-v2-proposal",
  "status": "proposal-only",
  "composition": "additive-proposals-over-byte-identical-v1",
  "inheritedV1": {
    "catalogId": "workload-catalog-v1",
    "schemaVersion": 1,
    "catalogPath": "catalog/workloads.v1.json",
    "catalogSha256": "6665664f984683e5b7d3fdc8c1602198124844704c224a526d48be2f02edf9d4",
    "schemaPath": "schemas/workload-catalog.schema.json",
    "schemaSha256": "7597aad1acd62c1f9a5e9343e8521d1c7906d59fddeec689eec19b50643c4b42",
    "entryCount": 38,
    "immutability": "byte-for-byte"
  },
  "proposalCount": 20,
  "prospectiveEntryCount": 58,
  "workloadContract": {
    "contractId": "v2-workload-contract-v1",
    "contractPath": "benchmarks/v2/shared/workload-contract.js"
  },
  "resultContract": {
    "contractId": "workload-result-v2-proposal-v1",
    "schemaVersion": 1,
    "schemaPath": "schemas/workload-result-v2-proposal.schema.json"
  },
  "performanceClaims": [],
  "entries": [
    {
      "id": "audio.fft.v1",
      "benchmarkSlug": "audio-fft",
      "title": "Radix-2 complex FFT",
      "status": "proposed",
      "stage": "contract-draft",
      "family": "dsp",
      "tier": "T2",
      "class": "kernel",
      "v1CoverageReferences": [
        "audio.webaudio-effects.v1",
        "numeric.fft-spectral-filter.v1"
      ],
      "input": {
        "fixtureState": "proposed",
        "immutable": true,
        "rightsStatus": "proposed-generated",
        "licenseSpdx": "CC0-1.0",
        "generator": {
          "algorithm": "xorshift32",
          "seed": "0x9e3779b9",
          "revision": "proposal-generator-v1",
          "serialization": "Canonical little-endian binary fields in declared parameter order; UTF-8 text uses Unicode 15.1 scalar values where present."
        },
        "format": "Interleaved little-endian f32 complex samples plus frozen little-endian f32 twiddle table.",
        "parameters": [
          {
            "name": "fft-size",
            "value": 4096
          },
          {
            "name": "transforms",
            "value": 32
          },
          {
            "name": "direction",
            "value": "forward"
          },
          {
            "name": "normalization",
            "value": "none"
          },
          {
            "name": "layout",
            "value": "interleaved-complex"
          }
        ],
        "manifestSha256": null
      },
      "oracle": {
        "kind": "numeric-tolerance",
        "reference": "Pinned f64 scalar DFT oracle rounded to f32 plus forward/inverse reconstruction invariants.",
        "checks": [
          {
            "id": "complete-output-bound",
            "description": "Complete complex output satisfies the hybrid bound."
          },
          {
            "id": "structural-invariants",
            "description": "Inverse reconstruction satisfies the hybrid bound."
          },
          {
            "id": "work-counters",
            "description": "DC, Nyquist, conjugate-symmetry, finite-value, and output-length invariants hold."
          }
        ],
        "floatingPointPolicy": "strict-f32-frozen-order",
        "nanPolicy": "reject",
        "signedZeroPolicy": "normalize-positive",
        "tolerance": {
          "mode": "absolute-and-relative",
          "absolute": 1e-06,
          "relative": 1e-05
        }
      },
      "work": {
        "fixed": true,
        "timeLimited": false,
        "unit": "32 forward transforms of 4,096 complex samples.",
        "repetitions": 1,
        "complexity": "O(transforms × n log n)",
        "counters": [
          "transforms",
          "samples",
          "stages",
          "butterflies",
          "complex-multiplies",
          "input-bytes",
          "output-bytes",
          "boundary-crossings"
        ],
        "counterTolerance": "exact"
      },
      "phases": {
        "load": "measured",
        "initialize": "measured",
        "transfer": "measured",
        "compute": "measured",
        "validation": "separate",
        "render": "not-applicable",
        "end-to-end": "measured"
      },
      "tracks": [
        {
          "id": "track-a-controlled",
          "track": "controlled",
          "algorithmEquivalence": "required",
          "contract": "Both targets use radix-2 decimation-in-time, the frozen stage order, f32 storage and intermediates, the frozen twiddle bytes, and one call per transform.",
          "variants": [
            {
              "id": "js-controlled",
              "target": "javascript",
              "algorithmFamilyId": "audio-fft-controlled-v1"
            },
            {
              "id": "wasm-linear-controlled",
              "target": "wasm-linear",
              "algorithmFamilyId": "audio-fft-controlled-v1"
            }
          ]
        },
        {
          "id": "track-b-optimized",
          "track": "optimized",
          "algorithmEquivalence": "separate-family",
          "contract": "Scalar, fixed-SIMD, changed radix, runtime twiddle generation, and host DSP variants are separate families with optimization logs.",
          "variants": [
            {
              "id": "js-optimized",
              "target": "javascript",
              "algorithmFamilyId": "audio-fft-js-optimized-v1"
            },
            {
              "id": "wasm-linear-optimized",
              "target": "wasm-linear",
              "algorithmFamilyId": "audio-fft-wasm-linear-optimized-v1"
            }
          ]
        }
      ],
      "missingCells": [
        {
          "cell": "implementation-and-results",
          "reason": "Implementation and measurement remain outside this proposal shard."
        }
      ],
      "performanceClaims": []
    },
    {
      "id": "audio.fir.v1",
      "benchmarkSlug": "audio-fir",
      "title": "Finite impulse response convolution",
      "status": "proposed",
      "stage": "contract-draft",
      "family": "dsp",
      "tier": "T2",
      "class": "kernel",
      "v1CoverageReferences": [
        "audio.webaudio-effects.v1",
        "numeric.fft-spectral-filter.v1"
      ],
      "input": {
        "fixtureState": "proposed",
        "immutable": true,
        "rightsStatus": "proposed-generated",
        "licenseSpdx": "CC0-1.0",
        "generator": {
          "algorithm": "xorshift32",
          "seed": "0xa1b2c3d4",
          "revision": "proposal-generator-v1",
          "serialization": "Canonical little-endian binary fields in declared parameter order; UTF-8 text uses Unicode 15.1 scalar values where present."
        },
        "format": "Little-endian f32 seeded-noise PCM followed by a frozen 256-tap little-endian f32 impulse response.",
        "parameters": [
          {
            "name": "samples",
            "value": 131072
          },
          {
            "name": "taps",
            "value": 256
          },
          {
            "name": "channels",
            "value": 1
          },
          {
            "name": "boundary",
            "value": "zero-extend"
          },
          {
            "name": "convolution",
            "value": "direct"
          }
        ],
        "manifestSha256": null
      },
      "oracle": {
        "kind": "numeric-tolerance",
        "reference": "Pinned f64 direct-convolution reference rounded to f32.",
        "checks": [
          {
            "id": "complete-output-bound",
            "description": "Every output sample satisfies the hybrid bound."
          },
          {
            "id": "structural-invariants",
            "description": "Impulse latency, output length, finite-value, and DC-gain invariants hold."
          }
        ],
        "floatingPointPolicy": "strict-f32-frozen-order",
        "nanPolicy": "reject",
        "signedZeroPolicy": "normalize-positive",
        "tolerance": {
          "mode": "absolute-and-relative",
          "absolute": 1e-06,
          "relative": 1e-05
        }
      },
      "work": {
        "fixed": true,
        "timeLimited": false,
        "unit": "One direct 256-tap convolution over 131,072 mono samples.",
        "repetitions": 1,
        "complexity": "O(samples × taps)",
        "counters": [
          "samples",
          "taps",
          "multiply-accumulates",
          "input-bytes",
          "coefficient-bytes",
          "output-bytes",
          "allocations",
          "boundary-crossings"
        ],
        "counterTolerance": "exact"
      },
      "phases": {
        "load": "measured",
        "initialize": "measured",
        "transfer": "measured",
        "compute": "measured",
        "validation": "separate",
        "render": "not-applicable",
        "end-to-end": "measured"
      },
      "tracks": [
        {
          "id": "track-a-controlled",
          "track": "controlled",
          "algorithmEquivalence": "required",
          "contract": "Both targets use direct convolution, increasing tap order, strict f32 multiply then add, zero extension, preallocated output, and one resident call.",
          "variants": [
            {
              "id": "js-controlled",
              "target": "javascript",
              "algorithmFamilyId": "audio-fir-controlled-v1"
            },
            {
              "id": "wasm-linear-controlled",
              "target": "wasm-linear",
              "algorithmFamilyId": "audio-fir-controlled-v1"
            }
          ]
        },
        {
          "id": "track-b-optimized",
          "track": "optimized",
          "algorithmEquivalence": "separate-family",
          "contract": "Blocking, SIMD, overlap-add, partitioned convolution, and native Web Audio are separate families with optimization logs.",
          "variants": [
            {
              "id": "js-optimized",
              "target": "javascript",
              "algorithmFamilyId": "audio-fir-js-optimized-v1"
            },
            {
              "id": "wasm-linear-optimized",